{
  "schema_version": 1,
  "run_id": "20261011-120000-abcdef",
  "capture_status": "partial",
  "screens": [
    {
      "id": "SCR-001",
      "provenance": "mockup_observation",
      "kind": "observation",
      "evidence_refs": [
        {
          "artifact": "capture/screenshots/page-001.png",
          "locator": "PAGE-001"
        }
      ],
      "name": "Supplier packages",
      "purpose": "Lists packages with View details links",
      "component_ids": [
        "SCR-004",
        "SCR-005"
      ],
      "observed_states": [
        {
          "state": "default",
          "description": "Two open packages",
          "evidence_refs": [
            {
              "artifact": "capture/screenshots/page-001.png",
              "locator": "PAGE-001"
            }
          ]
        }
      ]
    },
    {
      "id": "SCR-002",
      "provenance": "mockup_observation",
      "kind": "observation",
      "evidence_refs": [
        {
          "artifact": "capture/screenshots/page-001.png",
          "locator": "PAGE-002"
        }
      ],
      "name": "PKG-104 Kitchen refit",
      "purpose": "Shows package details with an Award Package button",
      "component_ids": [
        "SCR-006",
        "SCR-007"
      ],
      "observed_states": []
    },
    {
      "id": "SCR-003",
      "provenance": "mockup_observation",
      "kind": "observation",
      "evidence_refs": [
        {
          "artifact": "capture/screenshots/page-001.png",
          "locator": "PAGE-003"
        }
      ],
      "name": "PKG-105 Roof repair (awarded)",
      "purpose": "Shows an awarded package; Award Package is disabled",
      "component_ids": [
        "SCR-008"
      ],
      "observed_states": [
        {
          "state": "disabled",
          "description": "Award Package button disabled",
          "evidence_refs": [
            {
              "artifact": "capture/screenshots/page-003.png",
              "locator": "PAGE-003"
            }
          ]
        }
      ]
    }
  ],
  "components": [
    {
      "id": "SCR-004",
      "provenance": "mockup_observation",
      "kind": "observation",
      "evidence_refs": [
        {
          "artifact": "capture/screenshots/page-001.png",
          "locator": "PAGE-001"
        }
      ],
      "screen_id": "SCR-001",
      "type": "table",
      "label": "Package | Supplier | Value | Status",
      "fields": [],
      "actions": []
    },
    {
      "id": "SCR-005",
      "provenance": "mockup_observation",
      "kind": "observation",
      "evidence_refs": [
        {
          "artifact": "capture/screenshots/page-001.png",
          "locator": "PAGE-001"
        }
      ],
      "screen_id": "SCR-001",
      "type": "link",
      "label": "View details",
      "fields": [],
      "actions": [
        {
          "label": "View details",
          "control": "link"
        }
      ]
    },
    {
      "id": "SCR-006",
      "provenance": "mockup_observation",
      "kind": "observation",
      "evidence_refs": [
        {
          "artifact": "capture/screenshots/page-001.png",
          "locator": "PAGE-002"
        }
      ],
      "screen_id": "SCR-002",
      "type": "form",
      "label": "Award note",
      "fields": [
        {
          "label": "Award note",
          "input_type": "textarea"
        }
      ],
      "actions": []
    },
    {
      "id": "SCR-007",
      "provenance": "mockup_observation",
      "kind": "observation",
      "evidence_refs": [
        {
          "artifact": "capture/screenshots/page-001.png",
          "locator": "PAGE-002"
        }
      ],
      "screen_id": "SCR-002",
      "type": "button",
      "label": "Award Package",
      "fields": [],
      "actions": [
        {
          "label": "Award Package",
          "control": "button"
        }
      ]
    },
    {
      "id": "SCR-008",
      "provenance": "mockup_observation",
      "kind": "observation",
      "evidence_refs": [
        {
          "artifact": "capture/screenshots/page-001.png",
          "locator": "PAGE-003"
        }
      ],
      "screen_id": "SCR-003",
      "type": "button",
      "label": "Award Package",
      "fields": [],
      "actions": [
        {
          "label": "Award Package",
          "control": "button",
          "visibly_disabled": true
        }
      ]
    }
  ],
  "flows": [
    {
      "id": "SCR-009",
      "provenance": "mockup_observation",
      "kind": "observation",
      "evidence_refs": [
        {
          "artifact": "capture/screenshots/page-001.png",
          "locator": "PAGE-001"
        }
      ],
      "source_screen": "SCR-001",
      "visible_action": "View details",
      "destination_screen": "SCR-002",
      "destination_status": "captured"
    },
    {
      "id": "SCR-010",
      "provenance": "mockup_observation",
      "kind": "observation",
      "evidence_refs": [
        {
          "artifact": "capture/screenshots/page-001.png",
          "locator": "PAGE-002"
        }
      ],
      "source_screen": "SCR-002",
      "visible_action": "Award Package",
      "destination_screen": null,
      "destination_status": "no_target"
    },
    {
      "id": "SCR-011",
      "provenance": "mockup_observation",
      "kind": "observation",
      "evidence_refs": [
        {
          "artifact": "capture/screenshots/page-001.png",
          "locator": "PAGE-001"
        }
      ],
      "source_screen": "SCR-001",
      "visible_action": "Reports",
      "destination_screen": null,
      "destination_status": "capture_failed"
    }
  ],
  "data_entities": [
    {
      "id": "SCR-012",
      "provenance": "mockup_observation",
      "kind": "observation",
      "evidence_refs": [
        {
          "artifact": "capture/screenshots/page-001.png",
          "locator": "PAGE-001"
        }
      ],
      "name": "Package",
      "fields": [
        {
          "name": "supplier",
          "basis": "visible",
          "evidence_refs": [
            {
              "artifact": "capture/pages/page-001.txt",
              "locator": "line 5"
            }
          ]
        },
        {
          "name": "value",
          "basis": "visible",
          "evidence_refs": [
            {
              "artifact": "capture/pages/page-001.txt",
              "locator": "line 5"
            }
          ]
        }
      ]
    }
  ],
  "ambiguous_behaviours": [
    {
      "element_ref": "SCR-007",
      "unanswered": [
        "Who can award?",
        "Can an award be revoked?",
        "What happens if the award fails?"
      ],
      "evidence_refs": [
        {
          "artifact": "capture/screenshots/page-002.png",
          "locator": "Award Package"
        }
      ]
    }
  ],
  "limitations": [
    "Inventory is incomplete: the capture was partial.",
    "PAGE-004 (Reports) failed to capture (HTTP 500)."
  ]
}